{
  "$schema": "http://json-schema.org/draft-07/schema#",
  "title": "site.json — оболочка сайта GONKA.BLOG",
  "type": "object",
  "additionalProperties": false,
  "required": ["meta", "topbar", "footer", "desk", "nav", "scrolls", "chips"],
  "properties": {
    "showcase": {
      "type": "object",
      "additionalProperties": false,
      "description": "панель «Смотреть проекты» (необязательная)",
      "required": ["header", "hero", "cards"],
      "properties": {
        "header": { "type": "object", "additionalProperties": false, "required": ["tag", "badge"],
          "properties": { "tag": { "$ref": "#/$defs/str" }, "badge": { "$ref": "#/$defs/str" } } },
        "hero": { "type": "object", "additionalProperties": false, "required": ["status", "title", "lead"],
          "properties": { "status": { "$ref": "#/$defs/str" }, "title": { "$ref": "#/$defs/str" }, "lead": { "$ref": "#/$defs/str" } } },
        "moreLabel": { "$ref": "#/$defs/str" },
        "cards": {
          "type": "array", "minItems": 1, "maxItems": 8,
          "items": {
            "type": "object", "additionalProperties": false,
            "required": ["id", "name", "kind", "status", "image", "alt", "tagline", "facts", "links"],
            "properties": {
              "id": { "$ref": "#/$defs/str" }, "name": { "$ref": "#/$defs/str" }, "kind": { "$ref": "#/$defs/str" },
              "status": { "$ref": "#/$defs/str" }, "image": { "$ref": "#/$defs/str" }, "alt": { "$ref": "#/$defs/str" },
              "tagline": { "$ref": "#/$defs/str" },
              "facts": { "type": "array", "minItems": 1, "maxItems": 5, "items": { "$ref": "#/$defs/str" } },
              "links": { "type": "array", "minItems": 1, "maxItems": 4, "items": { "type": "object", "additionalProperties": false, "required": ["label", "url"],
                "properties": { "label": { "$ref": "#/$defs/str" }, "url": { "$ref": "#/$defs/str" } } } },
              "dossier": { "$ref": "#/$defs/str" },
              "video": { "$ref": "#/$defs/str" }
            }
          }
        }
      }
    },
    "exchanges": {
      "type": "object",
      "additionalProperties": false,
      "description": "блок «Где меня найти»: ссылки на профили (необязательный)",
      "required": ["title", "items"],
      "properties": {
        "title": { "$ref": "#/$defs/str" },
        "items": {
          "type": "array",
          "minItems": 1,
          "maxItems": 8,
          "items": {
            "type": "object",
            "additionalProperties": false,
            "required": ["label", "title", "url"],
            "properties": {
              "label": { "$ref": "#/$defs/str" },
              "title": { "$ref": "#/$defs/str" },
              "url": { "$ref": "#/$defs/str" }
            }
          }
        }
      }
    },
    "hero": {
      "type": "object",
      "additionalProperties": false,
      "description": "карточка-приветствие на главном экране (необязательная)",
      "required": ["title", "sub", "ctaProjects", "ctaAbout", "ctaWrite"],
      "properties": {
        "kicker": { "$ref": "#/$defs/str" },
        "title": { "$ref": "#/$defs/str" },
        "sub": { "$ref": "#/$defs/str" },
        "ctaProjects": { "$ref": "#/$defs/str" },
        "ctaAbout": { "$ref": "#/$defs/str" },
        "ctaWrite": { "$ref": "#/$defs/str" }
      }
    },
    "meta": {
      "type": "object",
      "additionalProperties": false,
      "required": ["title", "description"],
      "properties": {
        "title": { "$ref": "#/$defs/str" },
        "description": { "$ref": "#/$defs/str" }
      }
    },
    "topbar": {
      "type": "object",
      "additionalProperties": false,
      "required": ["status", "vibe", "brandSub"],
      "properties": {
        "status": { "$ref": "#/$defs/str" },
        "vibe": { "$ref": "#/$defs/str" },
        "brandSub": { "$ref": "#/$defs/str" }
      },
      "description": "coords (45°15'N 19°51'E) — хардкод в шаблоне, поля нет"
    },
    "footer": {
      "type": "object",
      "additionalProperties": false,
      "required": ["hint"],
      "properties": { "hint": { "$ref": "#/$defs/str" } }
    },
    "desk": {
      "type": "object",
      "additionalProperties": false,
      "required": [
        "modal-core",
        "modal-draft",
        "modal-failures",
        "modal-incoming",
        "modal-manifesto",
        "modal-network",
        "modal-srbija",
        "modal-trackers",
        "modal-video"
      ],
      "properties": {
        "modal-core": { "$ref": "#/$defs/deskWithStatement" },
        "modal-draft": { "$ref": "#/$defs/deskWithStatement" },
        "modal-failures": { "$ref": "#/$defs/deskWithStatement" },
        "modal-incoming": { "$ref": "#/$defs/deskWithStatement" },
        "modal-manifesto": { "$ref": "#/$defs/deskWithStatement" },
        "modal-network": { "$ref": "#/$defs/deskWithStatement" },
        "modal-srbija": { "$ref": "#/$defs/deskWithStatement" },
        "modal-trackers": { "$ref": "#/$defs/deskWithStatement" },
        "modal-video": { "$ref": "#/$defs/deskWithStatement" },
        "modal-showcase": { "$ref": "#/$defs/deskWithStatement" },
        "modal-serbia-wip": {
          "type": "object",
          "properties": {
            "tag": { "$ref": "#/$defs/str" },
            "statement": { "$ref": "#/$defs/str" }
          },
          "required": ["tag"],
          "description": "DEPRECATED: автоматически мигрируется в modal-trackers"
        }
      }
    },
    "nav": {
      "type": "array",
      "minItems": 8,
      "maxItems": 8,
      "items": { "$ref": "#/$defs/navItem" }
    },
    "scrolls": {
      "type": "object",
      "additionalProperties": false,
      "required": ["sites", "bots", "author"],
      "properties": {
        "sites": {
          "type": "object",
          "additionalProperties": false,
          "required": ["closedTag", "tag", "badge", "sub"],
          "properties": {
            "closedTag": { "$ref": "#/$defs/str" },
            "tag": { "$ref": "#/$defs/str" },
            "badge": { "$ref": "#/$defs/str" },
            "sub": { "$ref": "#/$defs/str" }
          }
        },
        "bots": {
          "type": "object",
          "additionalProperties": false,
          "required": ["closedTag"],
          "properties": { "closedTag": { "$ref": "#/$defs/str" } }
        },
        "author": {
          "type": "object",
          "additionalProperties": false,
          "required": ["closedTag"],
          "properties": { "closedTag": { "$ref": "#/$defs/str" } }
        }
      }
    },
    "chips": {
      "type": "array",
      "minItems": 6,
      "maxItems": 6,
      "items": { "$ref": "#/$defs/str" }
    }
  },
  "$defs": {
    "str": { "type": "string", "minLength": 1 },
    "deskWithStatement": {
      "type": "object",
      "additionalProperties": false,
      "required": ["tag", "statement"],
      "properties": {
        "tag": { "$ref": "#/$defs/str" },
        "statement": { "$ref": "#/$defs/str" }
      }
    },
    "deskTagOnly": {
      "type": "object",
      "additionalProperties": false,
      "required": ["tag"],
      "properties": { "tag": { "$ref": "#/$defs/str" } },
      "description": "statement «Полевое исследование и личный R&D.» — хардкод в шаблоне"
    },
    "navItem": {
      "type": "object",
      "additionalProperties": false,
      "required": ["label"],
      "properties": { "label": { "$ref": "#/$defs/str" } }
    }
  }
}
