{
  "meta": {
    "title": "GONKA.BLOG — Олег: Telegram-боты, сайты и сервисы под ключ",
    "description": "Олег — разработчик Telegram-ботов, лендингов и веб-сервисов. Запущенные боты и каналы, демо сайтов и сервисов, видео. Разберу задачу и доведу до запуска."
  },
  "topbar": {
    "status": "СТОЛ В РАБОТЕ",
    "vibe": "VIBE CODING",
    "brandSub": "// digital lab"
  },
  "footer": {
    "hint": "Свет показывает главное. Кликайте на названия и предметы верстака."
  },
  "desk": {
    "modal-incoming": {
      "tag": "ПРЯМАЯ ЛИНИЯ",
      "statement": "«Есть задача? Опишите — обсудим объём и срок.»"
    },
    "modal-draft": {
      "tag": "ЧЕРНОВИКИ // ХРОНИКА",
      "statement": "«Сначала был один лист и карандаш.»"
    },
    "modal-failures": {
      "tag": "ПОД СУКНО",
      "statement": "«Эту версию чуть не выбросил. Зато понял главное.»"
    },
    "modal-core": {
      "tag": "СИСТЕМА",
      "statement": "«Личная лаборатория. Всё собрано на одном столе.»"
    },
    "modal-video": {
      "tag": "КИНОПЛЁНКА",
      "statement": "«От черновика до кадра.»"
    },
    "modal-network": {
      "tag": "ИНСТРУМЕНТЫ",
      "statement": "«Связи, стек и инструменты.»"
    },
    "modal-manifesto": {
      "tag": "HOW I WORK",
      "statement": "«Меньше теории — больше работающих вещей.»"
    },
    "modal-trackers": {
      "tag": "ТАСК-ТРЕКЕРЫ",
      "statement": "«Внутренние рабочие инструменты и таск-трекеры.»"
    },
    "modal-srbija": {
      "tag": "SERBIA",
      "statement": "«Платформа: где жить в Сербии, с данными и источниками.»"
    },
    "modal-showcase": {
      "tag": "СМОТРЕТЬ ПРОЕКТЫ",
      "statement": "«Рабочие проекты в открытом доступе.»"
    }
  },
  "nav": [
    {
      "label": "ЧЕРНОВИКИ"
    },
    {
      "label": "ЛЕНДИНГИ"
    },
    {
      "label": "СИСТЕМА"
    },
    {
      "label": "ТРЕКЕРЫ"
    },
    {
      "label": "ПОД СУКНО"
    },
    {
      "label": "ВИДЕО"
    },
    {
      "label": "ИНСТРУМЕНТЫ"
    },
    {
      "label": "БОТЫ"
    }
  ],
  "scrolls": {
    "sites": {
      "closedTag": "САЙТЫ / ЛЕНДИНГИ",
      "tag": "САЙТЫ / ЛЕНДИНГИ",
      "badge": "7 РАБОТ",
      "sub": "Каталог демо-проектов"
    },
    "bots": {
      "closedTag": "БОТЫ // TELEGRAM"
    },
    "author": {
      "closedTag": "АВТОР"
    }
  },
  "chips": [
    "ENG",
    "2H",
    "VZN",
    "ATL",
    "LND",
    "TRK"
  ],
  "hero": {
    "title": "Разрабатываю и запускаю Telegram-ботов, сайты и сервисы под ключ",
    "sub": "Беру задачу, собираю рабочую версию, проверяю и довожу до запуска. Три Telegram-проекта уже работают, остальное на этом столе можно открыть и проверить.",
    "ctaProjects": "Смотреть проекты",
    "ctaAbout": "Кто я",
    "ctaWrite": "Написать"
  },
  "exchanges": {
    "title": "Где меня найти",
    "items": [
      {
        "label": "FL.ru",
        "title": "FL.ru: профиль фрилансера",
        "url": "https://www.fl.ru/users/textsmen"
      },
      {
        "label": "Kwork",
        "title": "Kwork: профиль фрилансера",
        "url": "https://kwork.ru/user/textsmen"
      },
      {
        "label": "Я.Исполнители",
        "title": "Яндекс Исполнители: профиль",
        "url": "https://uslugi.yandex.ru/profile/OlegB-3420530"
      },
      {
        "label": "Зерокодер",
        "title": "Маркетплейс Зерокодер: профиль",
        "url": "https://marketplace.zerocoder.ru/zerocoder/22058"
      },
      {
        "label": "GitHub",
        "title": "GitHub: репозитории проектов",
        "url": "https://github.com/textsmen-design"
      }
    ]
  },
  "showcase": {
    "header": {
      "tag": "[ ПРОЕКТЫ // В ОТКРЫТОМ ДОСТУПЕ ]",
      "badge": "4 ИЗБРАННЫХ"
    },
    "hero": {
      "status": "● ИЗБРАННОЕ: ЗАПУЩЕНО И РАБОТАЕТ",
      "title": "Смотреть проекты",
      "lead": "Четыре моих проекта, которые я довёл до запуска и открыл для всех: можно зайти на сайт, спросить бота, подписаться на канал. Это не макеты, а работающие системы, и я продолжаю их развивать. Нажмите ▶, чтобы увидеть каждый в десять секунд."
    },
    "moreLabel": "Подробное досье",
    "cards": [
      {
        "id": "reloca",
        "name": "RELOCA",
        "kind": "ПЛАТФОРМА",
        "status": "Работает",
        "image": "/previews/showcase-reloca.jpg",
        "alt": "RELOCA: главный экран платформы для выбора места жизни в Сербии",
        "tagline": "Платформа для тех, кто выбирает, где жить в Сербии.",
        "facts": [
          "Каталог из 146 мест Сербии: общины и округа, среда, документы, жильё.",
          "У каждого показателя помечено, откуда он: реальные измерения, справочные данные или демо.",
          "Живые замеры качества воздуха от агентства SEPA есть у 32 мест."
        ],
        "links": [
          {
            "label": "Открыть сайт",
            "url": "https://reloca.site"
          }
        ],
        "dossier": "modal-srbija",
        "video": "/videos/showcase-reloca.mp4"
      },
      {
        "id": "myaso",
        "name": "Мясная Троица",
        "kind": "БОТ + КАНАЛ + ЧАТ",
        "status": "Работает",
        "image": "/previews/showcase-myaso.jpg",
        "alt": "Мясная Троица: герои бота Курица, Свинья и Корова",
        "tagline": "Бот про цены на продукты: отвечает по-русски и не выдумывает цифры.",
        "facts": [
          "Около 425 товарных позиций Росстата по городам России, у каждой цены источник и период.",
          "Три героя с характером озвучивают ответ; нет данных — бот честно об этом говорит.",
          "Канал с рубриками по расписанию и чат обсуждений."
        ],
        "links": [
          {
            "label": "Открыть бота",
            "url": "https://t.me/myasnaya_troitsa_bot"
          },
          {
            "label": "Канал",
            "url": "https://t.me/basketmarket"
          },
          {
            "label": "Чат",
            "url": "https://t.me/basketmarket_chat"
          }
        ],
        "dossier": "modal-myasnaya-troitsa",
        "video": "/videos/showcase-myaso.mp4"
      },
      {
        "id": "politpersona",
        "name": "Politpersona",
        "kind": "КАНАЛ + БОТ + ЧАТ",
        "status": "Работает",
        "image": "/previews/showcase-politpersona.jpg",
        "alt": "Politpersona: вечерний выпуск новостей в Telegram",
        "tagline": "Новостной канал, который сам собирает и публикует выпуск каждое утро.",
        "facts": [
          "Выпуск «13 + 13»: события мира и России, только открытые источники.",
          "У каждой новости ссылка на первоисточник, заявления сторон подписаны, кликбейта нет.",
          "Бот отвечает на слово или тему двумя блоками «Мир» и «Россия»."
        ],
        "links": [
          {
            "label": "Открыть канал",
            "url": "https://t.me/politpersona"
          },
          {
            "label": "Бот",
            "url": "https://t.me/ru_politics_news_bot"
          }
        ],
        "dossier": "modal-politpersona",
        "video": "/videos/showcase-politpersona.mp4"
      },
      {
        "id": "detective",
        "name": "Детективный клуб",
        "kind": "ИГРОВОЙ БОТ",
        "status": "Работает",
        "image": "/previews/showcase-detective.jpg",
        "alt": "Детективный клуб: Telegram-бот с уликами и допросами",
        "tagline": "Детективные истории в Telegram: осмотри место, допроси подозреваемых, назови виновного.",
        "facts": [
          "Дела трёх уровней сложности, улики, алиби, досье на подозреваемых.",
          "ИИ-рассказчик отвечает на свободные вопросы; без ключа ИИ бот работает в обычном режиме.",
          "175 автоматических тестов движка."
        ],
        "links": [
          {
            "label": "Открыть бота",
            "url": "https://t.me/AI_CH_BOT_univers_bot"
          }
        ],
        "dossier": "modal-aichatbot",
        "video": "/videos/showcase-detective.mp4"
      }
    ]
  }
}
